{
  "schema_version": "0.3",
  "extension_id": "org.example.scheduler-carrier",
  "extension_version": "1.0.0",
  "kind": "in_process_plugin",
  "host": {
    "provider": "vllm",
    "name": "vllm",
    "version_range": ">=0.31,<0.32",
    "api_range": "==1.0"
  },
  "runtime": {
    "type": "python",
    "process_scope": "vllm-scheduler",
    "isolation": "trusted_in_process"
  },
  "lifecycle_owner": "vllm",
  "protocols": [],
  "implementation": [
    {
      "type": "python_module",
      "module": "example_scheduler.scheduler",
      "object": "Scheduler",
      "status": "active"
    }
  ],
  "requires_services": [],
  "requires_extensions": [],
  "resource_claims": [
    {
      "resource": "vllm.process-carrier.scheduler",
      "scope": "vllm-process-tree",
      "mode": "exclusive"
    }
  ],
  "components": [
    {
      "component_id": "scheduler-carrier",
      "contracts": ["vllm.scheduler-class.v1"],
      "execution_planes": ["scheduler"],
      "isolation": "trusted_in_process",
      "implementation_ref": "example_scheduler.scheduler:Scheduler",
      "permissions": []
    }
  ],
  "activation": {
    "entry_points": [],
    "environment": {},
    "additional_config": {}
  }
}
